{
  "metrics": [
    {
      "name": "accuracy",
      "description": "Claims are supported by supplied input.",
      "weight": 1,
      "rubric": {
        "0": "Contradicted.",
        "50": "Partially supported.",
        "100": "Fully supported."
      }
    }
  ],
  "scoring": { "scale": "0..100", "aggregate": "weighted-mean" },
  "acceptance": { "minimum_score": 85, "hard_gates": ["output-schema-valid"] },
  "on_failure": "reflect"
}
